Complex_Sentence_ID,Annotated_Triples
CS242,"(He; referred to as; Prince of Tollywood),(Prince of Tollywood; referred to as; He),(He; be; one of the most popular and influential actors in Telugu cinema),(He; have; popularity),(He; have; influence),(The audience; describe; him),(him; be; superstar of Telugu cinema)"
CS243,"(He; referred to as; Prince of Tollywood),(He; referred to as; media),(He; is; popular),(He; is; influential),(He; is; actor),(He; in; Telugu cinema),(The audience; describe; him),(him; is; the superstar of Telugu cinema)"
CS244,"(school; divided into; two sections),(road; bisects; entrance),(entrance; bisected by; road),(Underpass; Connected By; Gymnasium),(Gymnasium; Has; Mezzanine),(The mezzanine; is used; as an art gallery),(The mezzanine; function; art gallery)"
CS245,"(school; divide; primary section),(school; divide; secondary section),(road; bisected; entrance),(underpass; connect; gymnasium),(The gymnasium; has; mezzanine),(The mezzanine; is sometimes used as; an art gallery)"
CS246," (Lord Wei; is; only ethnic Chinese peer in The House of Lords),(Lord Wei; is; ethnic Chinese),(The House of Lords; has; Lord Wei),(He; takes; interest),(He; takes; British Chinese community issues),(He; focuses; social reform),(UK; strengthen economic ties; China),(UK; strengthen cultural ties; China)"
CS247,"(Jim; Moved; New York City),(Jim; From; Nashville),(Jim; Year; 2004),(He; found; position),(position; at; Marvel Comics),(He; handled; publicity),(He; handled; PR),(He; handled; publishing),(He; for; publishing),(He; managed; press),(He; managed; panels),(He; managed; conventions),(Press; at; conventions),(Panels; at; conventions)"
CS248,"(Jim; moved to; New York City),(Jim; moved from; Nashville),(New York City; moved to; 2004),(Nashville; moved from; 2004),(Jim; found; job),(job; at; Marvel Comics),(His; handling; publicity),(His; handling; PR),(His; handling; publishing),(He; managed; press),(He; managed; panels),(He; managed; conventions)"
CS249,"(reserves; had moved; close to the front),(The reserves; be ready; to exploit a breakthrough),(They; had advanced; on time),(Reserves; bunched up with; Leading divisions),(communication; block; lines),(The reserves; suffered; casualties),(The reserves; held up; casualties)"
CS250,"(Faillouox; has been around; five centuries),(Faillouox; mentioned; 1445)"
CS251,"(Faillouox; have; long history),(Faillouox; have; five centuries),(Faillouox; dates back to; 1445)"
CS252,"(It; decide; sell),(premises; sell; Great Patrick Street),(A new feed mill; will be built; in the Belfast Harbour Estate),(A new office block; will be built; in the Belfast Harbour Estate)"
CS253,"(Active shutter 3D systems; be used for; 3D films in theaters),(CRT; present; 3D images),(plasma; present; 3D images),(LCD; present; 3D images),(3D Films; can be displayed; with Active shutter 3D systems),(3D images; can be displayed; with Active shutter 3D systems)"
CS254,"(Active shutter 3D systems; are used to; present 3D films),(Active shutter 3D systems; present; 3D films),(some theaters; present; 3D films),(3D images; be used for; CRT),(3D images; be used for; plasma),(3D images; be used for; LCD),(3D images; be used for; video displays)"
CS255," (Active shutter 3D systems; used to; present 3D films),(CRT; present; 3D images),(plasma; present; 3D images),(LCD; present; 3D images),(video displays; present; 3D images)"
CS256,"(They; live in; Pleasanton; Florida),(They; have; two sons),(Mr. T; played; football),(Pain; played; football),(Mr. T; played; Pain),(football; played at; Brown University),(Mike Rowe; attended; Monsters University),(He; started; as a bench warmer on the football team)"
CS257,"(Walavne; No have; Railway station),(Nearest railway station; Located; Ranjangaon Road),(Ranjangaon Road; is; small village),(Ranjangaon Road; in; Parner taluka)."
CS258,"(Walavne; have; Railway Station),(The nearest Railway Station; is in; Ranjangaon Road),(Ranjangaon Road; is; small village),(Ranjangaon Road; located in; Parner Taluka)"
CS259,"(He; returned to; Genoa),(He; returned in; 1916),(He; opened; studio),(He; opened; Genoa),(He; worked; portrait artist),(He; paint; landscapes),(He; be; native of Liguria),(He; covered; entire region),(He; covered; neighbouring regions)"
CS260,"(He; return to; Genoa),(He; return to; 1916),(He; opened; studio),(He; was; portrait artist),(He; painted; landscapes of Liguria),(landscapes of Liguria; painted by; He),(He; covered; region),(He; painted; neighbouring regions)"
CS261,"(They; built; palace),(The palace; was; large),(It; be located; on the hill of Bribir),(area; control; It),(It; be; ideal place),(sea; overlooks; roads),(sea; overlooks; approaches)NA"
CS262,"(Arjuna; be unaware of; Karna being his brother),(Kunti; informed; Karna),(Kunti; of; brotherhood),(Karna; of; brotherhood),(Karna; knew; they were brothers),(Karna; decided to fight; Arjuna)"
CS263,"(He; got; primary education),(He; got education in; South America),(He; moved; United States),(He; moved in; 1987)"
CS264,"(He; renamed; shipping department),(He; renamed; Anchor Line of Steam Packet),(shipping department; renamed to; Anchor Line of Steam Packet),(renaming; happened in; 1870),(He; commissioned; pennant),(He; designed; artist William Cook),(The pennant; featured; an anchor)"
CS265,"(He; moved; to Jerusalem),(He; moved; in early 1990s),(He; was; 21),(He; studied at; Rubin Academy of Music and Dance),(He; received; M.A.),(He; received; piano),(His; taught by; Meira Smailovic),(His; taught by; Arbo Valdma),(His; taught by; Irina Berkovich)"
CS266,"(He; move; Jerusalem),(He; move; early 1990s),(He; be; 21),(He; move; 21),(He; attended; Rubin Academy of Music and Dance),(He; in; Jerusalem),(He; obtained; M.A. in piano),(He; studied under; Meira Smailovic),(He; studied under; Arbo Valdma),(He; studied under; Irina Berkovich)"
CS267,"(La Calle; is; port town),(This; in; province)"
CS268,"(La Calle; is a; port town),(La Calle; is in; this Province)"
CS269,"(Kate; became; strong Category 3 hurricane),(strong Category 3 hurricane; on; October 4),(Kate; move; southeast of Newfoundland),(Kate; be; Category 1 hurricane)"
CS270,"(Hedgehogs; have; gestation period),(gestation period; be; 30-40 days),(Range; can; 3-10 hoglets),(This species; produces; two litters),(two litters; occur in; season)"
CS271," (La Gloria; is a municipality of; Cesar Department of Colombia),(Cesar Department of Colombia; contains; La Gloria),(La Gloria; is located in; Southeastern part of Cesar Department)"
CS272,"(La Gloria; is in; Southeastern part of Cesar),(La Gloria; is in; Colombia),(La Gloria; is; municipality),(municipality; of; Cesar),(La Gloria; is in; Colombia)"
CS273,"(Fiji; be found in; It),(Fiji; breeds on; all the islands),(Rotuma; exclude from; breeding)"
CS274,"(It; is endemic to; Fiji),(It; breeds; on all the islands except Rotuma),(all the islands; except; Rotuma)"
CS275,"(It; native to; Fiji),(Fiji; breed on; all the islands),(Fiji; exclude; Rotuma)"
CS276," ( There; have; approximately 2000 mantid species worldwide ),( Mantid species; are located; worldwide ),(Mantid species; found; Asia),(The majority of mantid species; are; found in Asia)"
CS277,"( There; are around; 2000 mantid species ),(Most of these species; found in; Asia)"
CS278,"(Hopton; be; temporarily blinded),(Ammunition Cart; Exploded; ),(Explosion; cause; Blindness),(army; be short of; gunpowder)"
CS279,"(Hopton; be blinded; temporarily),(The next day; cause; Hopton's temporary blindness),(Hopton; cause; blindness),(ammunition cart; explode; blindness),(army; be short of; gunpowder)"
CS280,"(Construction; took; three years),(Divine service; was held; in 1848),(The consecration; occurred on; 25 July 1848)"
CS281,"(Construction; take; three years),(Divine service; began; 1848),(New cathedral; service began; 1848),(new cathedral; consecrated; 25 July 1848)"
CS282,"(Construction of the new cathedral; took; three years),(The first divine service; began on; 25 July 1848),(The first divine service; took place at; the cathedral),(Cathedral; be consecrated; 25 July 1848),(Cathedral; have consecration date; 25 July 1848)"
CS283,"(He; carried; out brutal medical experiments),(He; conducted; brutal medical experiments),(He; be responsible for; medical experiments),(Nazi concentration camp prisoners; subjected to; medical experiments),(He; have; SS rank)"
CS284,"(Vanunu; was; abducted),(He; lured; Rome),(He; smuggled; sea),(He; was tried; Israel),(Israel; tried; He),(He; was sentenced to; 18 years in prison)"
CS285,"(Vanunu; be; abducted),(He; lured; Rome),(He; smuggled; Israel),(He; smuggled; by sea),(He; was tried; 18 years in prison),(He; was sentenced to; 18 years in prison)"
CS286,"(He; attacked; hunters),(He; was; a white whale)"
CS287,"(City; bought; Threefoot Building),(Building; was planned for; Renovation),(Renovation; was planned for; former office building),(The Riley Center; was; almost completed),(The Riley Center; had been; almost completed),(building; be converted into; luxury hotel),(A Jackson firm; was hired for; the renovation)"
CS288,"(The Riley Center; was nearly; completed),(city; bought; Threefoot Building),(A Jackson renovation firm; was hired; to convert the office building into a luxury hotel),(A Jackson renovation firm; convert; the office building),(The office building; converted; into a luxury hotel)"
CS289," (He; married; Sarah Winter),(The couple; have; eight children),(eight children; belong to; The couple)"
CS290,"(He; married; Sarah Winter),(The couple; have; 8 children)"
CS291,"(He; married; Sarah Winter),(The couple; have; 8 children)"
CS292,"(Ghanaian midfielder; move to; VfB Stuttgart),(VfB Stuttgart; complete; Ghanaian midfielder),(January 2017; complete; move),(He; moved; duringJanuary transfer window),(Black Stars; compete in; Africa Cup of Nations),(He; moved; 31 January 2017)"
CS293,"(A Champagne Edition convertible; was launched; in 1978),(convertible; available in; blue),(convertible; available in; red metallic paint),(interior; have; white leatherette)"
CS294,"(A Champagne Edition convertible; was launched; in 1978),(Paint; available in; blue),(Paint; available in; red),(Paint; has color of; blue),(Paint; has color of; red),(Paint; is color of; blue),(Paint; is color of; red),(Paint; is type of; metallic),(interior; be; white leatherette)"
CS295,"(Russia; experienced; strong economic growth),(Russia; experienced; growth in 2000s),(Growth; slowed down; dramatically in 2012),(Reforms; have come along; at a slower pace),(The World Bank; reported on; Russia's economic growth)"
CS296,"(Russia; experienced; strong economic growth),(Russia; experienced; in the 2000s),(economic growth; slowed; significantly),(Reforms; had progressed; Not Fast Enough),(Reforms; had progressed; Slowly),(The World Bank; noted; Russia's growth),(The World Bank; noted; Russia's decline)"
CS297,"(Russia; had; strong economic growth),(strong economic growth; in; 2000s),(growth; slowed down; 2012),(Reforms; have come; slower pace),(The World Bank; reported; Russia's economic growth),(Russia; had; economic growth)"
CS298,"(emergency; create; uneasy calm),(two years; last; uneasy calm),(Discontent; lead to; wave in favour of the Janata party),(Janata Party; swept; Congress),(Congress; swept in; 1977)"
CS299,"(year; last; two years),(emergency; see; uneasy calm),(Janata party; support; wave),(Congress; swept away; 1977)"
CS300,"(Emergency; lasted; two years),(Emergency; brought; uneasy calm),(Discontentment; grew; 1977),(wave of support; emerged; 1977),(Congress; voted out of power; )"
CS301," (early missionaries; arrived in; Lahaina),(early missionaries; arrived in; 1823) They; explained; importance They; explained; Hawaiian Royalty They; explained; educational institution(small grave yard; contain; number of them)"
CS302,"(She; founded; Toronto Arts for Youth Award),(She; has worked as; an instructor),(She; is employed by; George Brown College),(George Brown College; teaches; theatre program)"
CS303,"(She; founded; Toronto Arts for Youth Award),(She; has worked as; instructor),(She; for; theatre program),(Theatre program; at; George Brown College)"
CS304,"(Vessels; Have; Anti Pollution Role),(They; be in; active service),(September; was case in; 2014)"
CS305," (These vessels; have; an anti-pollution role),(vessels; have; anti-pollution role),(They; be in active service; still),(It; is; September 2014)"
CS306," (The line; ran through; Todd Lane),(Preston; to; Bamber Bridge),(Todd Lane; until; 1972),(Lostock Hall Gas Works; served; line),(line; served; Lostock Hall Gas Works),(Lostock Hall Gas Works; until; 1972),(line; open for; freight trains),(freight trains; open until; 1972)"
CS307,"(The United States; disagree with; Europe),(Europe; disagree with; The United States),(The United States; have issue with; Europe),(Europe; have issue with; The United States)Not applicable."
CS308,"(The United States; disagree about; things),(Europe; disagree about; things),(They; agree on; other topics),(He; came to; dance),(He; came to; late in life)"
CS309,"(His; led to; rapid promotion),(Theodore; is an employee of; Acme Inc.),(Theodore; is employed by; Acme Inc.),(He; made; first appearance on Paris stage),(Walker; approaching; 60 years of age)"
CS310,"(He; appear; minor roles),(He; appear; two decades),(He; retain; fan base),(fan base; from; Cheyenne days),(He; is; popular guest),(He; attends; Western film festivals),(Jonathan Thirkield; is; American poet)"
CS311,"(Jonathan Thirkield; lives in; New York City),(Jonathan Thirkield; is; American poet),(Jonathan Thirkield; nationality; American)"
CS312,"(Jonathan Thirkield; lives; New York City),(TMC; has; medical staff),(medical staff; have; over 1000 physicians)"
CS313,"(2200 workers; complemented by; It ),(These workers; be engaged in; allied medical),(These workers; be engaged in; administrative),(These workers; be engaged in; support services),(Southfort; is a community in; DeSoto County; Florida)"
CS314,"(Southfort; is located; south of Fort Ogden),(Southfort; is located; on U.S. Route 17),(Southfort; is; an unincorporated community),(Southfort; locate in; United States),(Southfort; is; unincorporated community),(Southfort; is located in; Florida)"
CS315,"(Southfort; located south of; Fort Ogden),(Southfort; is situated on; U.S. Route 17),(Southfort; lies in; DeSoto County; Florida),(Southfort; is; an unincorporated community),(Southfort; located in; Florida),(an unincorporated community; located in; Florida)"
CS316,"(Southfort; located; south of Fort Ogden),(U.S. Route 17; passes through; Southfort),(Southfort; is in; DeSoto County),(She; offers; contract),(He; sign; contract)"
CS317,"(He; stamps; it),(He; use; signet ring),(it; get stamped; signet ring),(She; say; he),(He; can pay; her),(She; can be paid; later),(She; calls; IOU),(It; contains; amygdalin)"
CS318,"(Amygdalin; is; poisonous compound),(Laetrile; is related to; synthetic compound),(Laetrile; has been marketed for; cancer treatment),(Juneteenth; grew in popularity; 1980s and 1990s)"
CS319," (community leaders; met in; New Orleans),(community leaders; increase; celebration of Juneteenth),(Christian Unity Baptist Church; host; gathering),(gathering; celebrate; Juneteenth),(American; cooperate with; British),(British; cooperate with; American),(American; end cooperation; British),(British; end cooperation; American),(1946; mark the end of; cooperation between American and British)"
CS320," (Britain; tested; independently developed nuclear weapon),(Britain; developed; nuclear weapon),(nuclear weapon; tested in; 1952),(The Atomic Energy Act of 1946; ended; joint cooperation),(Britain; become; third country to test a nuclear weapon),(Britain; test; nuclear weapon),(third country; test; nuclear weapon),(He; got; camera)"
CS321,"(He; took; photographs),(He; performed; fights),(friends; performed; fights),(Legend of Zelda; inspired; fights),(Teenage Mutant Ninja Turtles; inspired; fights),(Rolfe; drew on; pictures),(Rolfe; used for; extra feel),(pictures; be used for; extra feel),(Phil Cookson; is; English professional rugby league footballer)"
CS322,"(He; played; 1960s),(He; played; 1970s),(He; played; 1980s),(He; represented; England),(England; at; representative level),(He; played for; Leeds),(Leeds; at; club level),(He; played; number 11),(He; played; number 12),( Phil Cookson; is; an English professional rugby league footballer )"
CS323,"(He; played in; 1960s),(He; played in; 1970s),(He; played in; 1980s),(He; represented; England),(He; represent; Leeds),(He; played; Number 11),(He; played; Number 12),(He; played; During Era of Contested Scrums),(Sol Joel Park; located in; Reading; Berkshire; England),(Reading; Berkshire; England; located in; Sol Joel Park)"
CS324,"(Solomon Joel; gifted; Corporation of Reading),(Corporation of Reading; received; park),(Solomon Joel; gave; park),(Sol Joel Park; is; public park),(Sol Joel Park; is in; Earley),(park; situated on; Wokingham Road),(Crabb; attend; primary schools locally)"
CS325,"(He; attend; Tasker Milward School),(He; attended for; 7 years),(Tasker Milward School; hold; He),(Tasker Milward; is; state secondary school),(Tasker Milward; located; Haverfordwest),(Crabb; attended; primary schools),(Crabb; located in; local area)"
CS326,"(He; was; student),(Student; attended; Tasker Milward School),(He; attended; Tasker Milward School),(Student; from; 1984 to 1991),(He; from; 1984 to 1991),(Tasker Milward; is; voluntary controlled state secondary school),(Tasker Milward; located in; Haverfordwest),(Muslim women; may be pressured; to wear veils)"
CS327,"(Muslim women; may be pressured to; leave school early),(Muslim women; may be pressured to; marry early),(Muslim women; is treated; particular concern),(Muslim women; may be pressured; to wear veils),(Women; may be pressured by; Muslim culture)"
CS328,"(Muslim women; may be pressured; to leave school),(Muslim women; may be pressured to; marry early),(Muslim women; is a concern; Treatment),(Muslim women; are pressured to wear; veils)"
CS329,"(Muslim women; may be encouraged; to leave school early),(Muslim women; may be expected to marry; at a young age),(They; performed; with Mos Def)"
CS330,"(They; perform; with Aquilla Sadalla),(They; performed with; Phil Cohran),(They; performed; North Sea Jazz Festival),(They; performed with; Mos Def)"
CS331,"(They; performed with; Aquilla Sadalla),(They; performed with; Phil Cohran),(They; performed; North Sea Jazz Festival),(Ramsay MacDonald; appealed; Hahn),(Hahn; was released; )"
CS332,"(Hahn; emigrated; to Britain),(Hahn; emigrated; in July 1933),(Britain; receive; Hahn),(in July 1933; accept; Hahn),(Hahn; settle in; Scotland),(He; founded; Gordonstoun),(He; based on; principles),(principles; of; school in Salem),(He; was born in; San Antonio; Texas),(He; was born in; 1954)"
CS333,"(His family; moved; to Highland Park),(His family; moved; in 1964),(board; made; adjustment),(hand plane; make; adjustment)"
CS334,"(Wood Removal; Can be Used; Other Methods),(process; repeat; until),(board; be; flat),(board; need to meet; satisfactory standards),(Auguste Le Duc; began constructing; bridge)"
CS335,"( bridge; connected; two islands),(Nature; destroyed; bridge),(Fleet Bank Building; stands on; site of Union Grove Elementary School),(Union Grove Elementary School; site of; Fleet Bank Building)"
CS336," (The Fleet Bank Building; is; the tallest commercial building in the Town of Newburgh),(The Fleet Bank Building; is located in; Town of Newburgh),(Union Grove Elementary School; was demolished; early 1980s),(Fleet Bank Building; houses; commercial offices),(Both teams; were in; bonus),(bonus; was for; Both teams)"
CS337,"(Game; last for; 8 minutes),(Game; unheard of in; Championship game),(Both teams; were in; bonus)"
CS338,"(Eight minutes; heard of; feat),(second half; heard of; feat),(game; be; unheard of),(The Nazis; forbade; her to sing the song),(The Nazis; forbade; her to perform on stage ever again)"
CS339,"(song; went over; Allied side),(It; became; popular),(The Nazis; forbade; her),(her; sing; song)"
CS340,"(They; forbade; her),(They; perform; on stage),(The song; went over; to the Allied side),(The song; from; Allied side),(Allied side; became popular on; It),(Austin; born in; Ascot Vale; Victoria; Australia)"
CS341,"(He; was; student),(He; attended; Melbourne Grammar School),(He; attended; 1927-1933),(She; appointed; Reader),(Reader; appointed-in; 1964)"
CS342,"(She; worked in; Department of English at AMU),(She; became; Professor of English),(In 1983; became; Professor of English).(She; retire; 1988),(She; appointed; Reader in AMU),(She; appointed; 1964)"
CS343,"(She; worked-in; Department of English),(She; become; Professor of English),(She; become; 1983),(She; retired; 1988),(She; appointed; Reader),(Reader; appointed in; AMU),(AMU; appointed in; 1964)"
CS344,"(She; worked in; Department of English),(she; become; Professor of English),(Professor of English; is; English),(She; retired in; 1988),(Bob Pittman; will be keynote; music business convention),(Sean Parker; will be keynote; music business convention)"
CS345,"(event; discuss; perspectives on future of music business),(Clear Channel's CEO; will share; his vision for the future),(All sectors; convene; new music business),(music business; awaits; exciting future),(Bob Pittman; is; keynote speaker),(Sean Parker; is; keynote speaker)"
CS346,"(all parts of the changing music industry; join; to discuss their ideas for the future),(Clear Channel; CEO of; Bob Pittman),(The future; is being discussed; music business),(music business; is being discussed; future),(Bob Pittman; be; keynote),(Sean Parker; be; keynote)"
CS347,"(music business; convening; to discuss the future),(music business; have; exciting new future),(Team; Stayed in; Phoenix),(Team; Stayed in; 1998)."
CS348,"(MLB; expanded; Diamondbacks),(Diamondbacks; included; 1998),(The Seals; move; 1998),(team; remained; Phoenix),(team; remained; 1998)"
CS349,"(MLB; expand; 1998),(Diamondbacks; join; MLB),(Seals franchise; forced; move),(Team; Stayed In; Phoenix),(Team; Stayed Until; 1998)"
CS350,"(MLB; expand; 1998),(Diamondbacks; be expanded; 1998),(Seals; move; away),(Teams; build; berimbaus),(Teams; build; plastic bottles)"
CS351,"(An expert; gave; clue),(An expert; gave; them),(them; were finished; berimbaus),(second tube; was lifted into place; 7 January 1850),(single line; was open to public traffic; 18 March 1850),(second line; was open; 19 October)"
CS352,"(The second tube; was lifted into place; on 7 January 1850),(A single line; was open to public traffic through these tubes; on 18 March 1850),(The second line; was open; on 19 October)"
CS353,"(New York; conceive; idea for a high class health care institution in Pakistan),(1985; conceive; idea for a high class health care institution in Pakistan)"
CS354,"(discussions; took place; before the present location),(meetings; took place; before the present location),(present location; selected; Islamabad),(retention; involves; memory),(memory; involves; repetition),(repetition; involves; enunciation),(enunciation; involves; diction)"
CS355,"(It; involves; ten factors),(Every letter; is used; a variety of times),(Letter; has; a usage),(Alphabet; consists of; letters),(It; involves; retention)"
CS356,"(enunciation; is; important),(diction; is; important),(Ten factors; use; letter in the alphabet),(Letter in the alphabet; repeated; ten factors),(He; quit; high school)"
CS357,"(He; met; Armenian music band),(He; learned; music),(He; experienced; music),(He; become; guitar player),(He; in; band),(Soviets; had been preparing; defenses),(Soviets; had been preparing; attack)"
CS358,"(panzer forces; weaken; operation),(Guderian; had been trying to rebuild; panzer forces),(Link; escaped; Zelda)"
CS359,"(Link; mortally wounded; ),(Zelda; collapsed in; arms),(Link; escape; Zelda)"
CS360,"(Link; is; mortally wounded),(Zelda; embrace; Link),(Link; escape; Zelda)"
CS361,"(Link; wounded; Escape),(Zelda; collapse; in arms),(A clipper; was; a sailing ship)"
CS362,"(It; had; three or more masts),(It; had; square rig),(It; was; very fast),(It; existed; 19th century),(A clipper; was; a fast sailing ship)"
CS363,"(It; had; three or more masts),(It; had; a square rig),(The clipper; was; a 19th-century ship),(Torpedo Moscow; not reinstated; Second Division)"
CS364,"(They; played in; amateur Third Division),(They; managed to reach; First Division),(They; had; 2 consecutive promotions),( 2009 registration ; had passed ; deadline ),(Torpedo Moscow; play; Third Division),(Third Division; after; 2009 registration deadline)"
CS365,"(Torpedo Moscow; reach; First Division),(Torpedo Moscow; have; two consecutive promotions),(She; married; Nathaniel Henry Alcock),(Nathaniel Henry Alcock; married; She),(She; married; 1905),(Nathaniel Henry Alcock; married; 1905)"
CS366,"(She; moved to; Canada),(She; moved with; him),(He; died of; cancer),(She; returned; to Britain),(She; obtained; post),(post; at; Plant Pathology Laboratory),(The Laboratory; moved; Harpenden),(He; resigned; 180),(He; died; Round Hill),(He; died; 1804)"
CS367,"(He; be; 57 years old),(Carey Earle; launch; Word Magazine),(Tom Livaccari; launch; Word Magazine),(Dan Pelson; launch; Word Magazine),(Word Magazine; launch in; 1995)"
CS368,"(Word Magazine; provided; original stories),(Word Magazine; provided; interviews),(Word Magazine; provided; games),(Word Magazine; provided; applications),(Word Magazine; provided; music),(Word Magazine; provided; interactive objects),(Word Magazine; provided; art),(Word Magazine; offer; community spaces),(Carey Earle; launch; Word Magazine),(Tom Livaccari; launch; Word Magazine),(Dan Pelson; launch; Word Magazine),(Word Magazine; launched in; 1995)"
