Complex_Sentence_ID,Annotated_Triples
CS124,"(she; ended; contract),(she; went; India),(She; lived in; Buddhistic monastery),(She; lived for; a year),(she; returned; Israel)"
CS125,"(J; get married; Mexico),(Linda; get married; Mexico).(They; come back; to their house),(They; come back; on their wedding day)"
CS126,"(J; get married; Mexico),(Linda; get married; Mexico),(they; return; house),(they; wed; on their wedding day)"
CS127,"(Yarrabee Flats; is located in; South Yarra),(Yarrabee Flats; is located in; Melbourne),(Yarrabee Flats; is located in; Australia),(building; consists of; five flats),(five flats; part of; building),(Frederick Romberg; design; Yarrabee Flats),(Yarrabee Flats; located at; 44 Walsh Street)"
CS128,"(Yarrabee Flats; is located in; South Yarra; Melbourne; Australia),(It ; consists; of five flats),(Frederick Romberg; design; it),(He; was; Australian architect)"
CS129,"(town; be; unique),( Fore Street; has; stream),(Stream; running on; either side),(One; flows into; Bristol Channel),(The; reaches; English Channel)"
CS130,"(Local folklore; claims; there is a stream running along Fore Street),(stream; flows into; Bristol Channel),(stream; reaches; English Channel),(Fore Street; has; two streams),(two streams; running on; either side),(town; has; unusual feature),(local folklore; according to; unusual feature)"
CS131,"1),(Exhaust gases; must not be cooled; below a certain temperature),(The risk; of; sulphur and nitrogen oxides condensing),(sulphur and nitrogen oxides; is present; risk),(Acids; could damage; ID Fans),(exhaust gases; must be avoided; Cooling)"
CS132,"(Exhaust gases; Had; Temperature limit),(Sulphur; form; Acids),(Nitrogen Oxides; form; Acids),(Acids; damage; ID Fans)"
CS133,"(Hardwick Court Farm; located in; Chertsey; Surrey),(Hardwick Court Farm; be established; during the Saxon period),(Hardwick Court Farm; is; large farm)"
CS134,"(Hardwick Court Farm; is in; Chertsey),(Chertsey; is in; Surrey),(Farm; established; Saxon period),(Hardwick Court Farm; is; large farm)"
CS135,"(Masood; have; criminal convictions),(His; first conviction; 1983),(His; be for; criminal damage),(He; convicted of with; knife possession in 2003),(knife possession in 2003; was; conviction)"
CS136,"(Masood; known to; police),(He; had; number of prior criminal convictions),(His; oldest conviction was; criminal damage in 1983),(His; most recent conviction; knife possession),(His; have conviction; December 2003)"
CS137,"(Allergy; stem from; POIS),(Hyposensitization therapy; cure; effects),(allergen immunotherapy; cure; effects),(post orgasmic illness syndrome; is called; This condition)"
CS138,"(POIS; is called; condition),(Allergy; originate from; POIS),(POIS; originate from; Allergy),(Hyposensitization therapy; cure; effects of POIS),(Allergen immunotherapy; cure; effects of POIS)."
CS139,"(She; used; it),(She; burst out; tanker),(She; destroyed; White Whale members),(White Whale members; nearby; She),(She; formed; giant robotic suits of armour),(She; armoured; herself),(She; armoured; teammates)"
CS140,"(He; allowed to return to; South Africa),(Emily Booth; built; house),(Emily Booth; had built; house),(House; was some considerable distance from; Cape Town),(he; be discouraged; active involvement in African affairs)"
CS141,"(The Council; was registered; in India),(Its; headquarters is in; New Delhi),(Its; headquarters is in; India)"
CS142,"(The Council; registered; India),(Its; headquarters-is; New Delhi),(India; registered; it),(It; registered; India),(Its; headquarters is in; India's capital city)"
CS143,"(Her; began; 1996),(She; convicted of; federal charges of tax evasion),(She; convicted of; September 1996),(She; sentenced; 37 months in prison)"
CS144,"(Fairmount Line; undergoing; major rehabilitation),(Boston; construct; four new stations),(Four new stations; be; constructed)#NAME? (Wachusett Station; is the new western terminus of; Fitchburg Line)"
CS145,"(The Fairmount Line; is being; renovated),(Boston; build; 4 new stations),(Four new stations; be built in; Boston),(Wachusett Station; work underway; new Fitchburg Line terminus),(new Fitchburg Line terminus; located; Wachusett Station)"
CS146,"(The Fairmount Line; is being; renovated),(Boston; build; four new stations),(Four new stations; being built in; Boston),(Fitchburg Line; have; new western terminus),(Work; begun; on),(Wachusett Station; is; the new western terminus)"
CS147," (Human; Navigate; Coral Sea),(Activity; Traditional; Navigation),( Queensland; have; 10 major ports),(ports; located; on the Queensland coast)"
CS148,"(Navigation; is; activity),(Navigation; has been; traditional activity),(Coral Sea; has; navigation),(Queensland; has; 10 major ports),(Queensland coast; has; 10 major ports)"
CS149," (Hakomi; is; a method),(Hakomi; is for; helping people),(It; uses; core material),(It; changing; core beliefs),(It; transform; their way of being in the world)"
CS150,"(Hakomi; is; method of transformation),(People; Help; Change Their Beliefs),(Goal; Achieve; Core Material),(People; help; change their way of being in the world)"
CS151,"(Everett; born in; Charleville; Queensland),(He; moved to; Brisbane),(He; joined; singing group),(He; as; teen)"
CS152,"(Editor; can be reconfigured using; Emacs Lisp),(Emacs Lisp; is; simple language),(Emacs Lisp; is; easy to learn),(Changes; require; editor to be restarted or recompiled),(Changes; require; Lisp code),(Lisp code; do not require; editor to be restarted or recompiled)"
CS153,"(Emacs Lisp; customizes; Almost all editor functionalities),(Emacs Lisp; is easy to; learn),(Changes; made with; Lisp),(Lisp; require; editor restart),(Lisp; require; recompilation)"
CS154,"(The Editor; can be reconfigured using Emacs Lisp; Almost all of the functionality),(Emacs Lisp; is a; simple and easy to learn language),(Changes; require; editor),(editor; restarted; not),(editor; recompiled; not)"
CS155,"(Mr Justice Sayed Zahid Hussain; has taken; an oath),(He; is the Chief Justice of; Lahore High Court)"
CS156," (Williams; be born in; Lansdowne; Cape Town; South Africa),(Lansdowne; be located in; Cape Town; South Africa),(Cape Town; be located in; South Africa),(Williams; grew up in; Mitchells Plain),(Mitchells Plain; established; under apartheid),(apartheid; established; Mitchells Plain)"
CS157,"(Marques de Sousa; went to; Rio de Janeiro),(deposed president; went to; Rio de Janeiro),(central government; offer; help),(help; could not be offered; central government),(Nation; Face; Rebellions and Riots),(Nation; Erupt; Rebellions and Riots)"
CS158,"(She; was born in; Los Angeles; California),(She; grew up in; Garden Grove),(She; grew up in; California),(She; attended; California State University; Fullerton)"
CS159,"(She; was born in; Los Angeles; California),(She; grew up in; Garden Grove),(She; lived in; California),(She; attended; California State University; Fullerton)"
CS160,"(Beasley; shot; August 2012),(He; drove; himself),(himself; to; hospital),(He; was released; next day)"
CS161,"(Beasley; be shot; August 2012),(He; drove; himself to a hospital),(He; released; following day)"
CS162,"(Copley; born in; Ingham; Queensland),(He; moved to; Brisbane),(He; moved at; a young age),(He; played; junior rugby league),(He; played; Aspley Devils),(He; attended; Wavell State High School),(He; signed by; Brisbane Broncos)"
CS163,"(Tracy; born in; Cincinnati),(She; has lived in; Ohio),(She; has lived; all her life),(She; attended; Colerain High School)"
CS164,"(Bavo; decide to reform himself; after wife's death),(Bavo; heard; sermon preached by a monk),(a monk; preached; sermon),(Saint Amand; preached; sermon),(Bavo; inspired by; sermon)"
CS165,"(Anshu Gupta; founded; organisation),(organisation; founded by; Anshu Gupta),(Anshu Gupta; founded in; 1999),(organisation; founded in; 1999),(He; left; corporate job),(He; begin; organisation),(Organisation; founded in; Sarita Vihar; New Delhi)"
CS166,"(Anshu Gupta; found; it),(Anshu Gupta; founded; in 1999),(He; left; corporate job),(He; start; organisation),(It; located; Sarita Vihar; New Delhi)"
CS167,"(Ferry; runs from; Ferry Lane),(Ferry Lane; in; Shepperton),(ferry; goes to; south bank of the river),(Weybridge; is a short walk from; Thames Street),(Thames Street; located in; Weybridge),(Ferry; situated; just below Shepperton Lock),(Shepperton Lock; is on; the reach above Sunbury Lock),(the reach; above; Sunbury Lock)"
CS168," (It; has; 150 young stars),(150 young stars; are; more massive and larger than Sun),(Stars; possess; very high luminosity),(Stars; life span; few million years)"
CS169,"(Palladio Film; is; international production company),(international production Company; is; Palladio Film),(Palladio Film; is based in; Cologne),(Palladio Film; is based in; London),(Palladio Film; specialize in; feature films),(Palladio Film; specialize in; documentaries)"
CS170,"(Palladio Film; is; an International production company),(company; based in; Cologne),(company; based in; London),(They; specialize in; feature films),(They; specialize in; documentaries)"
CS171,"(He; is; an international speaker and writer),(He; published; 24 books)"
CS172,"(He; is; an international speaker),(He; is; a writer),(He; published; 24 books)"
CS173,"(He; is; an international speaker and writer),(He; has published, 24 Books)"
CS174,"(Ngondoma Dam; was built; 1967),(Kwekwe; located north-west to; 67km),(Kadoma; located south-west to; 54km),(The Dam; supplied; water),(The Dam; supplied; Empress Nickel Mine),(The Dam; supplied; Ngondoma Irrigation Scheme)"
CS175,"(Mitchum; praises; those who have come out),(Mitchum; acknowledges; coming out may not be safe for LGBT people in multiple marginalized communities),(LGBT people in multiple marginalized communities; may not be safe for; coming out)"
CS176,"(Mitchum; praises; those who have come out for their bravery),(Mitchum; acknowledges; that coming out may not be safe for LGBT people in marginalized communities),(LGBT people in marginalized communities; may not be safe; coming out)"
CS177," (Most people; speak; Oromo),(Most people; speak; Harari),(Most people; speak; Somali),(Ethiopia; inhabit; Most people),(Qallu; referred to as; languages)"
CS178,"(She; was involved in; activities at Duke),(She; served as; treasurer of Chi Omega sorority),(She; was president of; field hockey club),(field hockey club; had; She)"
CS179,"(She; served as; Treasurer),(She; served as; Chi Omega sorority),(She; served as president of; field hockey club),(She; was involved in; activities at Duke)"
CS180,"(She; was involved in; activities at Duke),(She; served as treasurer of; Chi Omega sorority),(She; served as president of; field hockey club)"
CS181,"(A tornado; touched down on; 6 June 2010),(Fermi 2 generator building; damaged; It),(The tornado; caused; automatic shutdown),(Over 30000 people; lost; power),(power; lost in; the area)"
CS182,"(A weak tornado; touched down on; 6 June 2010),(Fermi 2 generator building; was damaged by; It),(The tornado; caused; automatic shutdown),(Over 30000 people; were left; without power),(Area; left; without power)"
CS183,"(Various jurisdictions; have; different definitions of assault weapons),(Government; have tried to change; definitions of assault weapons),(Many jurisdictions; Limit/Prohibit; Manufacture of assault weapons),(Many jurisdictions; Limit/Prohibit; Importation of assault weapons),(Many jurisdictions; Limit/Prohibit; Sale of assault weapons),(Many jurisdictions; Limit/Prohibit; Possession of assault weapons),(Laws; regarding; assault weapons),(assault weapons; are often; amended)"
CS184,"(Different jurisdictions; have varying definitions of; assault weapons),(Attempts; are made to; change),(Definition; of; Assault Weapons),(Manufacture; limited/prohibited; assault weapons),(Importation; limited/prohibited; assault weapons),(Sale; limited/prohibited; assault weapons),(Possession; limited/prohibited; assault weapons),(Legislatures; try to alter; definitions of assault weapons)"
CS185,"(definition; varies; jurisdiction),(Its; defines; vary),(Its; refers; different),(Government; limit/prohibit; manufacture/importation/sale/possession of assault weapons),(Legislative attempts; are often made to change; definitions of assault weapons)"
CS186,"(Scandinavia; influenced by; Timber),(Timber; influenced; Architecture in Scandinavia),(Timber; construct; roofs),(Europe; construct; roofs)"
CS187," (Faizi; is going to; Switzerland),(Faizi; is studying; hotel management at the University of Lausanne),(He; returns; with much fanfare),(He; completes; course),(He; has studied; to become a chef),(He; Has not studied; Hotel Management)"
CS188,"(Daniel; be; mortally wounded),(He; give; Arytom),(He; give; reward),(Reward; is; envelope),(envelope; contain; directions),(directions; lead to; missile silo)"
CS189,"(Daniel; is wounded; mortally),(He; gives; Arytom),(He; reward; Arytom),(The reward; is; an envelope containing directions to a functioning missile silo)"
CS190,"(Daniel; be; mortally wounded),(He; gives; Arytom),(Arytom; receives; reward),(Reward; contains; envelope),(Envelope; contains; directions),(Directions; lead to; missile silo)"
CS191,"(band; experiment; altered states of consciousness),(band; occur; Reformation Day),(They; rehearsed; night),(They; rehearsed; riff),(They; jamming; riff),(They; played; extended periods of time),(They; played; longer freeform improvised pieces of music)"
CS192,"(band; experimenting with; altered states of consiousness),(band; beginning experimenting; after Reformation Day),(They; rehearsed; night),(They; rehearsed; riff),(They; rehearsed; extended periods of time),(They; improvised; longer pieces of music)"
CS193,"(band; began experimenting with; altered states of consciousness),(Reformation Day; caused; altered states of consciousness),(They; rehearsed; frequently),(They; jamming; night),(They; jamming; riff),(They; jamming; extended periods of time),(They; created; longer freeform improvised pieces of music)"
CS194,"(John von Neumann; studied; equivalence groups),(He; identified; class of amenable groups),(These groups; have; no paradoxical decompositions)"
CS195,"(Angry crowds; burned; books),(Angry crowds; ended; war),(War; ended; public),(Hamsun; was imprisoned in; a psychiatric hospital),(Hamsun; was imprisoned for; several months)"
CS196," (Angry crowds; burned; his books),(Angry crowds; burned; in public),(War; ended; Angry crowds),(Hamsun; was confined to; psychiatric hospital),(Hamsun; for; several months)"
CS197,"(He; is; a hypnotist),(He; is ; an I Ching practitioner),(He; has experimented; successfully with occult therapeutic techniques)"
CS198,"(Amasova; is an agent of; KGB),(Amasova; is in; film),(Amasova; agent of ; Otdyel IV),(Otdyel IV; novelisation by ; Christopher Wood),(SMERSH; is; a department of Otdyel IV)"
CS199,"(solvents; separation of; reaction components),(non-traditional solvents; simpler with; separation of reaction components),(Evaporation; be used to separate; reaction components),(Condensation; be used to separate; reaction components),(Evaporation; is; a viable option),(Solvent; of; Evaporation),(Reaction components; for separating; Evaporation),(Air; into; Solvent),(Recycling; of; solvent),(Recycling; be; possible),(Solvent; condense; cold vessel),(Solvent; recycle; cold vessel)"
CS200,"(separation; is simpler than; traditional organic solvents),(Evaporation; into; air),(Evaporation; recyling; condensation),(condensation; into; cold recovery vessel),(method; simpler; separation)"
CS201,"(Morrison; pleaded guilty to; threatening and breach of peace charges),(Morrison; occurred on; 3 July 2013),(The strangulation charge; was dropped; April 2014),(The strangulation charge; occurred in; April 2014)"
CS202,"(Morrison; pleaded guilty; 3 July 2013),(Charge; Dropped; April 2014),(Strangulation Charge; Dropped; April 2014)"
CS203,"(It; is updated; manually),(It; includes; versions of articles),(versions of articles; have been; previously deleted)"
CS204,"(It; includes; versions of articles),(versions of articles; have been; previously deleted)"
CS205," (Salt Lake City; is between; Wasatch Range),(Salt Lake City; is between; Mount Nebo),(Nephi; Utah; lies),(Wasatch Range; located at; Southern End),(Mount Nebo; is the highest peak; in the Wasatch Range)"
CS206,"(Salt Lake City; is located; between the Wasatch Range),(Salt Lake City; is located; Mount Nebo),(Mount Nebo; rises above; Nephi; Utah),(Mount Nebo; is; highest peak),(highest peak; in; Wasatch Range)"
CS207,"(The Philippines; has; many islands),(Philippine islands; inhabit; Several ethnic groups),(Several ethnic groups; inhabit; Philippine islands),(Most of their languages; come from; Austronesian)"
CS208,"(The Philippines; have; many islands),(These islands; be home to; many ethnic groups),(Many ethnic groups; live in; these islands),(islands; speak; Austronesian),(Most; spoken; Austronesian),(languages; are; Austronesian)"
CS209,"(The Philippines; have; many inhabited islands),(ethnolinguistic groups; live; islands),(groups; inhabit; islands),(Most of these languages; are; Austronesian)"
CS210,"(Jull Weber; is from; Puerto Rico),(Honey Estrella; is from; Dominican Republic),(Jull Weber; conduct; Program),(Hony Estrella; conduct; Program)"
CS211,"(Harry Binswanger; born; Richmond; Virginia),(Harry Binswanger; be raised in; Richmond; Virginia),(Binswanger Glass Co.; founded; 1872),(Samuel Binswanger; founded; Binswanger Glass Co.)"
CS212," (U.S. Congress; passed; Spooner Amendment),(Spooner Amendment; passed on; 2 March 1902),(The Amendment; was to; Army Appropriation Act),(President; establish; civil government in Philippines)"
CS213,"(Congress; passed; Spooner Amendment),(Spooner Amendment; passed by; Congress),(Spooner Amendment; passed on; 2 March 1902),(The amendment; allowed; President),(President; create; civil government),(civil government; in; Philippines),(The Spooner Amendment; was an amendment to; the Army Appropriation Act),(The Spooner Amendment; pertained to; the Army Appropriation Act),(U.S. Congress; passed; Spooner Amendment),(Spooner Amendment; passed in; 1902)"
CS214,"(Lohr; grew; size and importance),(Lohr; grew; 1295 CE),(County Rieneck; become; Center)"
CS215,"(Dr Samuel Fisk Green; founded; The Green Memorial Hospital),(The Green Memorial Hospital; located in; Manipay Sri Lanka),(The Green Memorial Hospital; founded in; 1848),(The Green Memorial Hospital; established in; 1848),(Manipay; located in; Sri Lanka),(Dr Samuel Fisk Green; set up; The Green Memorial Hospital),(Dr Samuel Fisk Green; establish; The Green Memorial Hospital),(The Green Memorial Hospital; located in; Manipay),(Dr Samuel Fisk Green; do; establish The Green Memorial Hospital in 1848)"
CS216,"(Dr Samuel Fisk Green; found; Green Memorial Hospital),(Dr Samuel Fisk Green; locate; Manipay; Sri Lanka),(Green Memorial Hospital; establish in; 1848),(The Green Memorial Hospital; was established in; Manipay),(The Green Memorial Hospital; is located in; Sri Lanka),(The Green Memorial Hospital; was established in; 1848),(Dr Green; establish; Green Memorial Hospital),(Green Memorial Hospital; be located in; Sri Lanka),(Green Memorial Hospital; be founded in; 1848),(Green Memorial Hospital; originated in; Manipay Sri Lanka),(Green Memorial Hospital; located in; Manipay Sri Lanka),(Green Memorial Hospital; established in; 1848),(Green Memorial Hospital; founded in; 1848),(Green Memorial Hospital; located in; Manipay Sri Lanka)"
CS217,"(Dr Samuel Fisk Green; founded; Green Memorial Hospital),(Green Memorial Hospital; in; Manipay),(Green Memorial Hospital; in; Sri Lanka),(Green Memorial Hospital; founded; 1848),(The Green Memorial Hospital; was established; in Manipay; Sri Lanka),(The Green Memorial Hospital; was established; in 1848),(Green Memorial Hospital; found; 1848),(Green Memorial Hospital; located; Manipay; Sri Lanka),(Dr Samuel Fisk Green; is the founder of; Green Memorial Hospital),(Green Memorial Hospital; located in; Manipay),(Green Memorial Hospital; located in; Sri Lanka)"
CS218,"(Canadian cavalry; fought; through the wood),(them; be forced; eastwards),(German machine gun; fire; them),(Canadian Dragoons; wheeled into; woods),(German; attack; this action),(this action; caused by; German attack)"
CS219,"(Canadian cavalry; fought; wood),(wood; fought through; Canadian cavalry),(German; fired; machine gun),(them; forced; eastwards),(Units of the Canadian Dragoons; had to wheel; into the woods),(Units of the Canadian Dragoons; located at; north),(German; cause; movement)"
CS220,"(Weston Williamson; develop; offices),(Weston Williamson; build; offices),(Weston Williamson; build in; 2002),(Their; located on; Tower Bridge Road),(Their; located in; London),(office; has; 60 architects),(architects; working on; various projects)"
CS221,"(Weston Williamson; develop; offices),(Weston Williamson; build; offices),(Weston Williamson; develop; London),(Weston Williamson; build; London),(offices; develop in; 2001),(offices; build in; 2001),(Their office; is on; Tower Bridge Road),(It; have; 60 architects),(60 architects; working on; different projects)"
CS222,"(Giske Bridge; opened; 1987),(Giske Bridge; had; toll),(Giske Bridge; ceased; toll)"
CS223,"(Giske Bridge; opened; 1987),(Giske Bridge; have; toll),(Giske Bridge; remove; toll),(Giske Bridge; apply; toll) until 2009"
CS224,"(It; built; 1837),(It; closed down; ten years later),(The furnace; came into use; during the American Civil War)"
CS225,"(It; built; 1837),(It; close down; ten years later),(The furnace; came into use; again),(American Civil War; came into use; The furnace)"
CS226,"(Stevens; be Senate President for; four terms from 2009 to 2012),(He; led; bipartisan coalition),(bipartisan coalition; include; 10 Democrats),(bipartisan coalition; include; 6 Republicans)"
CS227," (Storytelling; have; ancient roots),(Art; have; ancient roots),(Most cultures; have; traditional fables),(Traditional fables; have; animals),(Animals; are; characters),(Animals; feature in ; Fables),(Fables; feature ; Animals in human-like roles)"
CS228," (storytelling; have; ancient roots),(art; have; ancient roots),(Most cultures; have; traditional fables),(Traditional fables; have; animals as characters),(Animals; given; human-like characteristics),(Animals; have; traditional fables)"
CS229," (Both storytelling; have; ancient roots),(Storytelling; have; ancient roots),(Art; have; ancient roots),(Most cultures; have; traditional fables),(Traditional Fables; take on; human characteristics),(Animals; have; human characteristics)"
CS230,"(Private individuals; provided; priests),(Private individuals; provided; temples),(Private individuals; provided; sacrifices),(religious clubs; be created; purpose)"
CS231,"(Private individuals; provided; priests),(Private individuals; provided; temples),(Private individuals; provided; sacrifices),(sacrifices; for; other deities),(Many religious clubs; were created for; this purpose)"
CS232,"(private individuals; provided; priests),(private individuals; provided; temples),(private individuals; provided; sacrifices),( sacrifices; for; other deities),(Many religious clubs; were created; for this purpose)"
CS233,"(He; has won; 48 events on the Japan Golf Tour),(48 events on the Japan Golf Tour; is won by; He),(He; be; leading money winner in 1982),(He; be; leading money winner in 1983),(He; be; leading money winner in 1985),(He; be; leading money winner in 1986)"
CS234,"(He; has won; 48 events on the Japan Golf Tour),(He; was the leading money winner; 1982),(He; was the leading money winner; 1983),(He; be; leading money winner in 1985),(He; be; leading money winner in 1986)"
CS235,"(Urchin Software Configuration Management system; is; free),(The Urchin Software Configuration Management system; is; open source),(The Urchin Software Configuration Management system; is; open),(Urchin Software Configuration Management system; is; open source),(solution; manage; configuration),(enterprise scale solution; provide; manage),(configuration; manage; software applications),(these applications; run on; many servers),(many servers; across; enterprise)"
CS236,"(Urchin Software Configuration Management system; be; free),(Urchin Software Configuration Management system; be; open source),(Solution; provides; enterprise scale solution),(enterprise scale solution; manages; configurations of many software applications),(Applications; run; many servers),(Many servers; across; enterprise)"
CS237,"(Nitric oxide; can diffuse; all over),(Nitric oxide molecules; act on; neurons),(neurons; be acted on by; Nitric oxide molecules),( Nitric oxide molecules; act on; neurons),(neurons; not connected by; synapses),(neurotransmitter; transmit; information),(neuron; transmit; information)"
CS238,"(nitric oxide; diffuses; all over),(It; act on; neurons),(It; act on; synapse)"
CS239,"(Viral RNA transcript; inhibits; expression of ICP0 gene),(expression of ICP0 gene; inhibited by; Viral RNA transcript),(Antisense RNA mechanism; is used; during latent infection),(Antisense RNA mechanism; has function; latent infection control)"
CS240,"(Viral RNA Transcript; Inhibits Expression Of; Gene),(ICP0; is inhibited by; antisense RNA mechanism),(Viral RNA Transcript; inhibits; Gene Expression),(Latent Infection; affects; Gene Expression),(Antisense RNA; inhibits; ICP0 expression),(ICP0; inhibited by; Antisense RNA)"
CS241,"(He; referred to as; Prince of Tollywood),(Prince of Tollywood; referred by; media),(He; is; a very popular and influential actor in Telugu cinema),(He; is; very popular),(He; is; influential),(He; is; an actor in Telugu cinema),(Audience; labelled him as; Superstar of Telugu cinema)"
