Complex_Sentence_ID,Annotated_Triples
CS001,"(She; compiled; crosswords),(James; compiled; crosswords),(She and James; compiled; crosswords),(crosswords; for; multiple newspapers and magazines),(They; Started; Publishing company),(Publishing company; Started; 1978)"
CS002,"(Mantell; born in; Bridgwater),(Mantell; born in; Somerset),(He; studied at; University of Bath)"
CS003,"(Mantell; born in; Bridgwater Somerset),(He; studied at; University of Bath)"
CS004,"(Toby Irwin; was unaware of; situation),(Irwin; ended; fight),(Campbell; fell to; ground)"
CS005,"(Yazan Halwani; is a; street artist),(Yazan Halwani; is from; Beirut),(Yazan Halwani; is from; Beirut Lebanon),(He; paints; murals),(He; combines; renewed Arabic calligraphy and portraits)"
CS006," (The Catholic Institute of Sydney; deliver; theological studies),(It; provides; undergraduate qualification),(It; provides; postgraduate qualification),(students; prepare for; ordination to the priesthood),(It; prepare; students),(Sydney College of Divinity; is a member institution of; It)"
CS007,"(Catholic Institute of Sydney; is; tertiary educational facility),(Sydney College of Divinity; is a member institution of; It),(It; delivers; theological studies),(theological studies; delivers at; undergraduate qualification),(theological studies; delivers at; postgraduate qualification),(students; prepare for; ordination to priesthood in Catholic Church)"
CS008,"(The Catholic Institute of Sydney; is; a tertiary educational facility),(The Institute; is a member of; Sydney College of Divinity),(It; offers; theological studies),(It; offers; undergraduate studies),(It; offers; postgraduate studies),(Students; prepared for; ordination in Catholic Church),(It; prepare; students)"
CS009,"(Many men; spent day; drinking in pub),(Men; drinking in; pub),(Aim of Expressing Respect to Women; was; lost),(Aim of Expressing Sympathy to Women; was; lost)"
CS010,"(boatman 1; was; hanged),(boatman 2; was; hanged),(Two Boatmen; were; hanged),(Morse; does not believe; they were guilty)"
CS011,"(two boatmen; were; hanged),(Morse; does not believe; they were the perpetrators)"
CS012,"(Few WikiKnights; are ready on; day one),(WikiKnights; are; ready),(WikiKnights; are ready on; day one),(Apprentices; challenged; WikiDragon),(Ancient Scipts; tell of; Apprentices),(apprentices; escape; misadventure)"
CS013,"(Few WikiKnights; ready; on day one),(Ancient scripts; tell of; apprentices),(Apprentices; challenged; WikiDragon),(Apprentices; Fight; WikiDragon),(They; escaped; misadventure),(They; tell about; misadventure)"
CS014,"(Pinocchio; sets; Lorenzini's theatre),(Lorenzini's theatre; on fire; Pinocchio),(Lorenzini; changes; career),(Lorenzini; lures; children),(Lorenzini; lures; pleasure island),(children; be lured; pleasure island),(Children; drink; cursed water),(Water; turn; them),(Them; be turned into; donkeys)"
CS015,"(She; joined; adult movie),(She; join; 14),(She; worked at; Salon),(She; worked; her young auntie's Salon)"
CS016,"(She; joined; adult movie),(She; age at joining; 14),(She; worked at; Salon),(Salon; owned by; auntie),(auntie; relation to; She)"
CS017,"(She; had; restaurant project),(restaurant project; in; Lafayette),(restaurant; have; upstairs dining room),(restaurant; have; downstairs playroom),(The restaurant; was called; Tutti),(It; was; downtown Lafayette),(area; separated for; adults),(area; separated for; children)"
CS018," (She; had; Tutti),(Tutti; located in; downtown Lafayette),(dining room; be in; upstairs),(dining room; be for; adults),(It; have; downstairs playroom),(Downstairs playroom; be; for children)"
CS019,"(Implantation; is; complicated),(Medical Devices; is implanted; complicated),(Infection; cause; Inflammation),(Inflammation; cause; Pain),(Implantation; cause; Infection),(Implantation; cause; Inflammation),(Implantation; cause; Pain),(Invasive Medical Procedures; have; risks),(Medical device implantation; carries; similar complications),(Medical device implantation; carries; other invasive medical procedures),(Other invasive medical procedures; carries; similar complications)"
CS020,"(medical devices; have; complications),(Infection; cause; Pain),(Infection; cause; Inflammation),(Inflammation; cause; Pain),(Procedure; cause; Infection),(Procedure; cause; Inflammation),(Procedure; cause; Pain),(Invasive medical procedures; carry; risks),(Implantation process; associated with; Complications)"
CS021,"(Medical devices; pose; risks of complications),(infection; include; Complications),(inflammation; include; Complications),(pain; include; Complications),(Medical procedure; carries; risk of infection),(Medical procedure; carries; risk of inflammation),(Medical procedure; carries; risk of pain),(Medical devices; cause; pain),(Medical devices; cause; infection),(Medical devices; cause; inflammation)"
CS022,"(Reduce cost; will; This upgrade),(Increase flexibility; will; This upgrade),(Any manufactured CBC; can be configured; for zero to four solid boosters),(performance loss; necessitate; standardized CBC)"
CS023,"(A Control pitcher; has; good control of his pitches),(A Control pitcher; issues; below average number of bases on balls),(A Control pitcher; is skilled at; throwing his pitches)"
CS024,"(A Control pitcher; has; good control),(A Control pitcher; of; his pitches),(A Control pitcher; limits; number of bases on balls),(A pitcher; can be; a Control pitcher),(Control pitcher; exhibit; good control of pitches)"
CS025,"(Long Yun; is; ethnic Yi General),(Long Yun; become; Governor of Yunnan),(Long Yun; be; cousin of Lu Han)"
CS026," (Long Yun; be; ethnic Yi General),(ethnic Yi General; belong to; Long Yun),(Long Yun; became; Governor of Yunnan),(Governor of Yunnan; was; Long Yun),(Long Yun; is a cousin of; Lu Han),(Lu Han; is a cousin of; Long Yun)"
CS027," (Carnaval music; is written for; occasion),(Carnaval Music; is easy to; dance)"
CS028,"(Carnaval music; is often written for; the occasion),(Carnaval Music; is easy to; dance)"
CS029," (Carnaval music; is written for; the occasion),(Carnaval Music; is easy to; dance )"
CS030,"(He; has been; a full professor at ETH Zurich),(He; has been at; ETH Zurich),(He; has been since; 2003),(He; has been; Director of the Institute for Mathematical Research at ETH),(Director of the Institute for Mathematical Research at ETH; since; 2009)"
CS031,"(He; has been; full professor at ETH Zurich),(full professor at ETH Zurich; since; 2003),(He; has been; Director of the Institute for Mathematical Research at ETH),(He; has been; Director since 2009),(Director of the Institute for Mathematical Research at ETH; is; He)"
CS032,"(The winners; met; 2005 National League Championship Series),(Division Series; met; 2005 National League Championship Series),(two Division Series; met; 2005 National League Championship Series),(The winner; became; National League champion),(National League champion; face; American League champion),(2005 World Series; feature; National League champion),(2005 World Series; feature; American League champion)"
CS033,"(The winners; met in; 2005 National League Championship Series),(Two Division Series; met in; 2005 National League Championship Series),(winner; became; National League champion),(National League; face; American League),(2005 World Series; champion; National League),(2005 World Series; champion; American League)"
CS034,"(Alauddin; have; love scenes),(Padmini; have; love scenes),(rumours; are about; Alauddin and Padmini's love scenes),(Shri Rajput Karni Sena; protest; This),(members; accuse; Bhansali),(organization; accuse; Bhansali),(Bhansali; distort; history)"
CS035,"(I; got; computer),(I; was; 7),(It; is; Windows Vista Laptop),(Windows Vista Laptop; is; Inspiron 1525),(I; get; Toshiba Satellite laptop),(Toshiba Satellite laptop; have; Windows 7),(The casing of the Toshiba; started to split; within a year),(The casing of the Toshiba; had an effect on; Toshiba),(Toshiba; was affected by; splitting of the casing)"
CS036,"(I; got; first computer),(I; was; 7),(""It""; ""was""; ""Windows Vista Laptop; Inspiron 1525""),(""Windows Vista Laptop""; ""was""; ""Inspiron 1525""),(I; got; Toshiba Satellite laptop),(Toshiba Satellite laptop; with; Windows 7),(casing; started to split; within a year)"
CS037,"(NPAS2; paralogous to; CLOCK),(CLOCK; plays; key role),(key role; in maintaining; mammalian circadian rhythms),(NPAS2; has a role in; brain),(NPAS2; related to; circadian rhythms),(NPAS2; generate ; mammalian circadian rhythms),(NPAS2; maintain ; mammalian circadian rhythms)"
CS038,"(NPAS2; be paralogous to; CLOCK),(CLOCK; is; key protein),(CLOCK; involves; maintenance of circadian rhythms in mammals),(NPAS2; role; generator),(NPAS2; role; maintainer),(NPAS2; thought to be; generator),(NPAS2; thought to be; maintainer),(mammalian circadian rhythms; maintained by; NPAS2)"
CS039,"(NPAS2; paralogous to; CLOCK),(Clock; Maintain; Circadian Rhythms),(NPAS2; be; generator and maintainer of mammalian circadian rhythms),(NPAS2; role; generator and maintainer of mammalian circadian rhythms),(brain; have; NPAS2)"
CS040,"(Etanercept; is; biologic),(Chemical formulations; have; different laws),(Biologics; have; different laws),(The United States; does not allow; generic biologics),(generic biologics; be produced; not allowed)"
CS041,"(Watanabe; stated; Soka Gakkai),(Soka Gakkai; has challenged; conventional ideas and structures in Japan),(Watanabe; stated; Soka Gakkai),(Soka Gakkai; has challenged; since its beginnings),(Makiguchi; question; imperial system),(Makiguchi; question; popular organizations),(Makiguchi; questioned; public education),(Makiguchi; questioned; armed forces),(Makiguchi; questioned; religious authority)"
CS042,"(Makiguchi; question; imperial system),(Makiguchi; question; established institutions),(Soka Gakkai; challenge; established notions and hierarchies),(Soka Gakkai; begin; its beginnings),(Soka Gakkai; has disrupted; traditional structures in Japan),(Watanabe; stated; that the Soka Gakkai has disrupted traditional structures in Japan since its founding.)"
CS043,"(Merqury Quaye; found; The Awards),(The Awards; is; annual program),(The Awards; is; annual),(It; rewards; Radio DJs),(It; celebrates; Mobile DJs),(It; celebrates; Club DJs),(Its; foster; development),(It; foster; Ghana music industry),(Ghana music industry; develop; It)"
CS044,"(He; released; results),(He; released; day),(report; take; one day)"
CS045,"(He; opened; laboratory of ceramics),(laboratory of ceramics; in; Umbria),(He; operates; between art and craft),(He; does; personal exhibitions),(He; especially in; Holland),(He; participates; numerous collectives),(He; is a member of; numerous collectives)"
CS046,"(Waldo; went to; Rome),(A disciple; went to; Rome),(Waldo and a disciple; went to; Rome),(Waldo and a disciple; went in; 1179),(Pope Alexander III; welcome; them),(them; be welcomed by; Pope Alexander III),(Pope Alexander III; be in; Rome),(Roman Curia; welcomed; them)"
CS047,"(Waldo; went to; Rome),(one of his disciples; went to; Rome),(They; were welcomed by; Pope Alexander III),(Pope Alexander III; welcomed; They),(Pope Alexander III; and; Roman Curia)"
CS048," (The Cliff Bridge; opened in; 1827),(It; improved; access),(It; was; a foretaste),(a foretaste; of; ambitious plans),(ambitious plans; of; It)"
CS049," (The Cliff Bridge; opened in; 1827),(Cliff Bridge; improved; Access),(There; be; ambitious plans),(ambitious plans; be; ahead)"
CS050," (Cliff Bridge; opened in; 8127),(It; improved; access),(It; be; foretaste),(Foretaste; of; ambitious plans),(It; have; ambitious plans)"
CS051," (The cecum; is; a pouchlike structure),(small intestine; junction of; large intestine),(The cecum; is part of; colon)"
CS052,"(Mr Reidal; be; inaugural Principal),(He; managed; school),(He; managed in; 1953),(He; managed in; 1956),(Bill Walker; was; next Principal),(He; serve from; 1957),(He; serve to; 1959)"
CS053,"(He; gets; hopelessly lost),(He; returns to; his home town),(He; does not want; to go home),(He; visits; Marty Tothero),(He; visits; his old basketball coach)"
CS054,"(Pro Football Hall of Fame; located near; It),(Pro Football Hall of Fame; host; annual game ),( Pro Football Hall of Fame Game; held; annually ),(It; Hosts; High School Football Games),(It; Hosts; College Football Games)"
CS055,"(Pro Football Hall of Fame; next to; It),(Pro Football Hall of Fame; host; annual Pro Football Hall of Fame Game),(Game; be; annual Pro Football Hall of Fame Game),(It; host; high school games),(It; host; college games)"
CS056,"(Pro Football Hall of Fame; situated next to; It),(Pro Football Hall of Fame; host; It),(It; host; Pro Football Hall of Fame Game),(Pro Football Hall of Fame Game; be hosted; each year),(high school; hosts; games),(college; hosts; games)"
CS057,"(I; invest; time),(law; waste; time),(me; damaging; value created by me and others),(this law; damaging; value created by me and others)"
CS058,"(me; destroy; value created),(others; destroy; value created),(I; spend; hundreds of hours),(I; spend; thousands of hours),(I; photographing; monuments)"
CS059,"(Hubbard; suffer; back injury),(Hubbard; occur; 2009 season),(2009 season; with; Bayhawks),(He; be unable to play; 2009 season),(He; has not played in; MLL)"
CS060," (Hubbard; suffered; back injury),(Hubbard; occurred prior to; 2009 season),(He; unable to play; 2009 season),(He; unable to play; Bayhawks),(Hubbard; has not played in; MLL),(Hubbard; experienced; injury)"
CS061,"(Adolescents; strive for; freedoms),(Parents; challenged by; child's activity on social media),(Social media sites; have; predators),(Predators; are; increasingly present)"
CS062,"(Adolescents; strive for; freedoms),(Parents; be uncertain of; what their child is doing on social media sites),(Predators; are present; social media sites),(social media sites; have; Predators)"
CS063,"(pieces; come; various flavors),(packages; available in; individual foil),(They; come; in various flavors),(Foil packages; be available in; individual)"
CS064,"(foil packages; available in; pieces),(Pieces; come in; various flavors)"
CS065,"(Sellers; born in; Santa Monica; California),(He; grew up in; New York City),(He; moved; Rome)"
CS066,"(Sellers; born in; Santa Monica; California),(He; grew up in; New York City),(He; is from; New York City),(He; moved to; Rome)"
CS067,"(Sellers; Born; Santa Monica; California),(He; grew up in; New York City),(He; moved to; Rome)"
CS068,"(He; received; BA),(He; received; PhD),(University of Chicago; in; 1989),(He; PhD in; 1993),(UCLA; was; advisor),(Basil Gordon; was; advisor)"
CS069,"(She; walked out; wedding),(She; on; wedding),(Wedding; out on; She),(She; is; single),(She; holds; intense anger toward Richard),(Richard; ruined; wedding),(She; became; furious),(She; learned; pregnant),(Richard; told; her),(Richard; got; vasectomy)"
CS070,"(Nisbet; married; Isabella Frances Fairweather),(Isabella Frances Fairweather; married; Nisbet),(Nisbet; marry date; 1875),(Isabella Frances Fairweather; marry date; 1875),(Nisbet; died in; London),(Nisbet; died on; 1 April 1899),(Nisbet; have; long-term lung infection),(Nisbet; survived by; wife),(Nisbet; survived by; two children)"
CS071,"(Nisbet; married; Isabella Frances Fairweather),(Nisbet; married in; 1875),(He; die; London),(He; die; 1 April 1899),(He; had; long-term lung infection),(long-term lung infection; was had by; He),(He; survived by; wife),(He; survived by; two children)"
CS072,"(The Dark Knight; is; steel roller coaster),(Six Flags Great Adventure; operate; It),(The Dark Knight; is enclosed; )"
CS073,"(Sampras; won; match),(Sampras; won; four sets),(Sampras; announce; retirement),(Sampras; retirement; game),(game; announcement; 2003 US Open)"
CS074," (Sampras; won; match),(Sampras; won; four sets),(He; announce; retirement),(He; retire; 2003 US Open)"
CS075," (Low utility people; should not exist; ),(People; have low utility; )"
CS076,"(statement; says; Low utility people should not exist),(statement; has little bearing on; practical morals),(low utility people; had not, existed)"
CS077,"(New England political interests; feared; growth of the West),(New England political interests; established; themselves),(growth of the West; feared; New England political interests),(A majority; oppose; purchase)"
CS078,"(New England political interests; feared; growth of the West),(A majority of the Federalist Party; opposed; purchase)"
CS079," (Mussolini; wanted; Cameroon),(Mussolini; wanted; corridor to Libya),(Mussolini; wanted to control; Cameroon),(Mussolini; wanted to control; corridor),(Cameroon; have a corridor between; Libya),(He; wanted to take over; Cameroon),(He; create a passageway between; Libya),(Cameroon; create a passageway between; Libya),(Mussolini; have ambitions; gain Cameroon),(Mussolini; have ambitions; route linking it to Libya)"
CS080,"(Mussolini; sought to acquire; Cameroon),(He; want; corridor),(corridor; link; Cameroon),(corridor; link; Libya)"
CS081,"(These; convert to; Catholicism),(These; flee; Spanish Inquisition),(They; live in; New World),(They; intermarried; Native Americans),(They; intermarried; old Christians),(American Southwest; populated by; groups),(groups; populated; American Southwest)"
CS082,"(converts; fled; Spanish Inquisition),(They; came; New World),(They; live; New World),(They; intermarried; Native Americans),(They; intermarried; old Christians),(The American Southwest; was populated by; these people),(These people; populated; The American Southwest)"
CS083,"(He; attended; Dartmouth College),(He; become associated with; Bishop Museum),(He; Spend; 60 years),(He; Roam; Pacific),(He; sought out; Polynesian settlement sites),(He; excavated; relics),(He; photographed; petroglyphs)"
CS084,"(He; attended; Dartmouth College),(He; became associated with; Bishop Museum),(He; spent; 60 years),(He; roaming; Pacific),(He; sought out; Polynesian settlement sites),(Polynesian settlement sites; sought out by; He),(He; excavated; relics),(He; photographed; petroglyphs)"
CS085,"(Catharina Ledeboer; create; series),(Viacom International; produce; series),(Tatiana Rodriguez; executive produces; the series)"
CS086," (Catharina Ledeboer; create; series),(Viacom International; produced; series),(Tatiana Rodriguez; is; executive producer),(executive producer; of; series)"
CS087,"(A; consists of; straight sections),(A; consists of; sharp turns),(Skiers; are reflected; from the edges of the run),(In theory; follows; complementary angles)"
CS088,"(Duxford; houses; airfield),(collection; of; aircraft),(airfield; houses; collection),(UK; have; most significant aircraft collection),(most significant aircraft collection; locates in; UK),(Duxford airfield; is now home to; many unique aircraft),(many unique aircraft; are located at; Duxford airfield)"
CS089,"(Duxford; is home to; a large number of aircraft),(collection; be; one of the most significant),(These aircraft; are; remarkable),(These aircraft; are; unique)"
CS090,"(Jill; made; blueberry BBQ chicken),(Christina; thought; chicken had great flavor),(Gratin; was; delicious),(Gratin; had; too much cream and herbs)"
CS091,"(Jill; made; blueberry BBQ chicken),(Christina; thought; chicken had great flavor),(The Gratin; was; delicious)1),(It; have; too much cream) 2),(It; have; too much herbs)"
CS092,"(She; feels; torn),(Her; has; grandmother),(grandmother; is; dying),(She; feels; responsible),(The fairy godmother; has; replacement),(Fairy tale world; in; good hands)"
CS093,"(She; feels; torn),(Her; has; grandmother),(Grandmother; is; dying),(She; feel; killing),(The fairy godmother; found; a replacement),(The fairy godmother; can rest; .),(The fairy tale world; is in; good hands)"
CS094,"(The Pechenegs; fought; horse archers),(They; Fired; Arrows),(They; rely on; wagon laager),(It; serve; rallying point),(It; serve; last defence)"
CS095," (French Army; had; 47 divisions),(January 1914; had; 47 divisions),(French troops; were composed of; 777000),(colonial troops; were composed of; 47000),(The troops; were organized into; 21 regional corps),(Cavalry; Attached; There),(Field Artillery; Attached; There)"
CS096,"(McDuff; chose to use; piece of broomstick),(McDuff; chose to use; car),(He; choked; Sullivan),(Green; dumped; body),(McDuff; dumped; body),(Green & McDuff; dumped; bushes)"
CS097," (The Dan Ryan Expressway; was constructed; in the 1960s),(Hardin Square; was; demolished),(Stanford Park; was; demolished),(Residents of Chinatown; waited for; a replacement),(a replacement; waited for; 30 years)"
CS098," (Dan Ryan Expressway; constructed; 1960s),(1960s; construct; Dan Ryan Expressway),(Hardin Square; demolished; Stanford Park),(Residents; waited; 30 years),(Chinatown; had residents waiting; 30 years)"
CS099,"(Hotaru; is; hero),(Hotaru; from; Seido),(He; devotes himself to; preserving law and order),(He; be described; as a zealot)"
CS100,"(Hotaru; is; hero),(Hotaru; from; Seido),(He; devote; himself),(He; preserve; law and order),(He; be described as; a zealot)"
CS101,"(Multiple births; occur; often),(Rams; bred for; raising lambs for slaughter),(Rams; raising; lambs for slaughter),(Commercial operations; rely on; multiple births),(Rams; Used For; Siring Lambs for Slaughter)"
CS102,"(Multiple births; occur; often),(Rams; produce; Lambs),(Lambs; be used for; Slaughter),(Commercial operations; benefit from; multiple births),(Rams; be bred; for specific purposes),(Rams; have purpose; specific)"
CS103,"(1876 presidential election; be; 23rd quadrennial election),(1876 presidential election; held; November 7),(The election; was held in; United States)"
CS104," (The 1876 United States presidential election; took place on; November 7th),(United States; participated in; 1876 United States presidential election),(23rd quadrennial presidential election in America; held in; 1876),(US; held; presidential election),(presidential election; held in; 1876),(1876 presidential election; be; November 7th),(November 7th; relate to; 1876 presidential election)"
CS105,"(John Olney; reported; ketamine caused irreversible changes in two small areas of the rat brain),(ketamine; caused; irreversible changes in two small areas of the rat brain),(two small areas of the rat brain; in; 1989),(Human; have; significant differences in metabolism),(Human; have; differenes in metabolism from the rat brain),(Rat brain; have; differences in metabolism from human brain)No possible triples can be extracted from this sentence."
CS106," (It; founded in; 1994),(Kevin Wentworth Preston; founded; it),(It; is based in; village of Pinkney),(village of Pinkney; is location of ; It),(It; is near; Malmesbury),(Malmesbury; is part of; Wiltshire),(Cotswolds; is in; area of England)"
CS107,"(Vidal; taught; aeronautics),(Vidal; taught at; West Point),(He; be; one of the first Army Air Corps pilots),(Vidal; was a pioneer in; commercial aviation industry)"
CS108,"(Vidal; taught; aeronautics),(Vidal; taught; West Point),(aeronautics; taught at; West Point),(He; be ; one of the first Army Air Corps pilots),( He ; join ; Army Air Corps),(He; be; later a pioneer),(He; be; a pioneer in commercial aviation industry),(later a pioneer; be; in commercial aviation industry)"
CS109,"(LSSU; finished; second),(LSSU; in; CCHA),(They; lost to; Harvard),(In the 1989 NCAA Tournament; was; the quarterfinals),(Harvard; won; national championship),(1989; year of; national championship)"
CS110,"(Wiccans; believe in; afterlife),(Reincarnation; is a teaching of; Wicca),(The New Forest coven; originate; 1930s)"
CS111," (Hundreds of soldiers; are standing; in front of the palace),(Soldiers; are; hundreds),(Palace; is in front of; hundreds of soldiers),(soldiers; randomly firing; crowd)"
CS112,"(Parke; played for; FC Delco),(He; play; college soccer at Drexel University),(Drexel University; host; college soccer),(MetroStars; drafted; him),(him; drafted by; MetroStars),(2004 MLS SuperDraft; last pick of; him)"
CS113,"(Parke; played for; FC Delco),(He; played; college soccer),(He; attended; Drexel University),(MetroStars; drafted; him),(He; be; last overall pick of SuperDraft)"
CS114,"(Parke; played; FC Delco),(He; played; four years of college soccer),(He; played at; Drexel University),(Drexel University; have; college soccer),(He; drafted by; MetroStars),(MetroStars; drafted; Him),(He; drafted in; 2004),(He; chosen with; 60th overall pick),(He; chosen with; last overall pick),(He; chosen with; MLS SuperDraft)"
CS115," (Room; filled with; items related to bomb production),(Room; filled with; newspaper articles about LTTE bombings in Sri Lanka),(Colombo; is; hectic)"
CS116,"(LTTE; use; materials),(LTTE; bomb; Sri Lanka),(newspaper articles; describe; LTTE bombings),(Colombo; cuts to; morning)"
CS117,"(room; full of; bomb making material),(room; full of; newspaper articles),(Colombo; be in; Typical Morning),(Room; starts in; Film),(Newspaper articles; are about; LTTE bombings in Sri Lanka),(LTTE bombings; occurred in; Sri Lanka),(Colombo; be; busy),(Colombo; be; in),(in; refer; morning)"
CS118," (The Monument; was destroyed; in 1940),(Monument; was destroyed; 1940),(Nazis; destroyed; it),(Nazis; invaded; Poland),(visible restoration; was done in; 1955)"
CS119,"(the games; sold; 60000 copies),(60000 copies; by; February),(games; sold; 100000 copies)"
CS120,"(Peter; punched; Manson),(Peter; punched; face),(Lois; accuse; Manson),(Manson; destroy; Lois' son),(They; found; Manson)"
CS121,"(Peter; punched; Manson),(Manson; punched by; Peter),(Peter; punched; face),(face; punched by; Peter),(Lois; accused; Manson),(They; found; Manson),(Manson; destroyed; son)"
CS122,"(Most prestigious race in NASCAR; is; Daytona 500),(Daytona 500; is the running of; 56th),(This; was the running of; Daytona 500)"
CS123,"(she; went to; India),(She; lived in; Buddhistic monastery),(She; returned to; Israel),(She; returned in; 2001)"
